{
  "schemaVersion": 1,
  "contractId": "v1-base-workload-result-v1",
  "status": "candidate-validation-passed",
  "source": {
    "repository": "https://github.com/PaulKinlan/wasm-vs-js",
    "commit": "ef8ea1e4021bad15384a350aba1b76d0ca540f91"
  },
  "workload": {
    "entryId": "serialization.json-telemetry.v1",
    "variantId": "wasm-linear-controlled",
    "track": "controlled",
    "algorithmFamily": "json-parse-fixed-query-canonicalize"
  },
  "provenance": {
    "registration": {
      "path": "benchmarks/v1/serialization-json-telemetry/registration.v1.json",
      "bytes": 3626,
      "sha256": "e3506ae8cb013a0257756324ec8eb69bc724d858ef906588a73299c5d6710d4e",
      "immutableUrl": "https://github.com/PaulKinlan/wasm-vs-js/blob/ef8ea1e4021bad15384a350aba1b76d0ca540f91/benchmarks/v1/serialization-json-telemetry/registration.v1.json"
    },
    "catalog": {
      "path": "catalog/workloads.v1.json",
      "bytes": 110208,
      "sha256": "6665664f984683e5b7d3fdc8c1602198124844704c224a526d48be2f02edf9d4",
      "immutableUrl": "https://github.com/PaulKinlan/wasm-vs-js/blob/ef8ea1e4021bad15384a350aba1b76d0ca540f91/catalog/workloads.v1.json"
    },
    "sources": [
      {
        "path": "benchmarks/v1/serialization-json-telemetry/workload.js",
        "bytes": 11159,
        "sha256": "54e2ee54b225d8454664dc6a24f5fa178ee0652ccf0e7e01eea93b17f29530f8",
        "immutableUrl": "https://github.com/PaulKinlan/wasm-vs-js/blob/ef8ea1e4021bad15384a350aba1b76d0ca540f91/benchmarks/v1/serialization-json-telemetry/workload.js"
      },
      {
        "path": "benchmarks/v1/serialization-json-telemetry/telemetry.c",
        "bytes": 6369,
        "sha256": "8ce3f16fcdcd795689ac1c55b373880ca0bc20ab16f5719507bb19080e0dcf85",
        "immutableUrl": "https://github.com/PaulKinlan/wasm-vs-js/blob/ef8ea1e4021bad15384a350aba1b76d0ca540f91/benchmarks/v1/serialization-json-telemetry/telemetry.c"
      }
    ],
    "manifests": [
      {
        "path": "public/artifacts/serialization-json-telemetry/build-manifest.json",
        "bytes": 2224,
        "sha256": "c21535cfaf5ef0afe37f26573b2961d63c18e489afad73215fb23124717e5fef",
        "immutableUrl": "https://github.com/PaulKinlan/wasm-vs-js/blob/ef8ea1e4021bad15384a350aba1b76d0ca540f91/public/artifacts/serialization-json-telemetry/build-manifest.json"
      },
      {
        "path": "public/artifacts/serialization-json-telemetry/fixture-manifest.json",
        "bytes": 2243,
        "sha256": "89a1039bd30c2ab72499102e653a7ae44a4c9c0c731408223afe2d7df6cb31cf",
        "immutableUrl": "https://github.com/PaulKinlan/wasm-vs-js/blob/ef8ea1e4021bad15384a350aba1b76d0ca540f91/public/artifacts/serialization-json-telemetry/fixture-manifest.json"
      },
      {
        "path": "public/artifacts/serialization-json-telemetry/input-manifest.json",
        "bytes": 602,
        "sha256": "0cfe5e4dbf3ce2bee9e047a32688a6b5f48ea64dcb120cb24ac9ddfa90a34fb0",
        "immutableUrl": "https://github.com/PaulKinlan/wasm-vs-js/blob/ef8ea1e4021bad15384a350aba1b76d0ca540f91/public/artifacts/serialization-json-telemetry/input-manifest.json"
      },
      {
        "path": "public/artifacts/serialization-json-telemetry/output-manifest.json",
        "bytes": 4010,
        "sha256": "3acf258af1cf022c3b6af581107e16324222e551ae3c16f05d522782399bf387",
        "immutableUrl": "https://github.com/PaulKinlan/wasm-vs-js/blob/ef8ea1e4021bad15384a350aba1b76d0ca540f91/public/artifacts/serialization-json-telemetry/output-manifest.json"
      }
    ],
    "artifact": {
      "path": "public/artifacts/serialization-json-telemetry/telemetry.wasm",
      "bytes": 7509,
      "sha256": "8d03d4fedbbef99659d95e8930a3db6757eb460d73301c9e95c9eafbfe330c42",
      "immutableUrl": "https://github.com/PaulKinlan/wasm-vs-js/blob/ef8ea1e4021bad15384a350aba1b76d0ca540f91/public/artifacts/serialization-json-telemetry/telemetry.wasm"
    },
    "buildRecipe": {
      "path": "scripts/build-v1-json-telemetry.ts",
      "bytes": 5893,
      "sha256": "38d17c9c50a8e4b3f127608f2ae21f566137823fd7d301120f0c88b5f5750831",
      "immutableUrl": "https://github.com/PaulKinlan/wasm-vs-js/blob/ef8ea1e4021bad15384a350aba1b76d0ca540f91/scripts/build-v1-json-telemetry.ts"
    },
    "demo": [
      {
        "path": "public/benchmarks/serialization.json-telemetry.v1/index.html",
        "bytes": 6312,
        "sha256": "41663f3778071736e28180f161274f7a80f1e62df2dffa798e1a29f942fc1ddb",
        "immutableUrl": "https://github.com/PaulKinlan/wasm-vs-js/blob/ef8ea1e4021bad15384a350aba1b76d0ca540f91/public/benchmarks/serialization.json-telemetry.v1/index.html"
      },
      {
        "path": "public/telemetry-demo.js",
        "bytes": 2495,
        "sha256": "d853860e797cca1d0b6215c1cfce4991c0eb8c9db362bba638e1292ef6b29e4e",
        "immutableUrl": "https://github.com/PaulKinlan/wasm-vs-js/blob/ef8ea1e4021bad15384a350aba1b76d0ca540f91/public/telemetry-demo.js"
      },
      {
        "path": "public/telemetry-worker.js",
        "bytes": 6142,
        "sha256": "fd1d42643f351e4eebb349806978f17623aa65eeb0d19e068eccf2c1a87ef5e4",
        "immutableUrl": "https://github.com/PaulKinlan/wasm-vs-js/blob/ef8ea1e4021bad15384a350aba1b76d0ca540f91/public/telemetry-worker.js"
      },
      {
        "path": "public/telemetry-module-loader.js",
        "bytes": 1325,
        "sha256": "be4597255d4657f3b5b2e89a5461e3196a441f297dfd26cd59a42db4c6e5dcb1",
        "immutableUrl": "https://github.com/PaulKinlan/wasm-vs-js/blob/ef8ea1e4021bad15384a350aba1b76d0ca540f91/public/telemetry-module-loader.js"
      },
      {
        "path": "server.ts",
        "bytes": 100198,
        "sha256": "5e40bb1e787fc8012e7cac8e29527f28525a2f32f4a59216c4b24e9623d0a8f8",
        "immutableUrl": "https://github.com/PaulKinlan/wasm-vs-js/blob/ef8ea1e4021bad15384a350aba1b76d0ca540f91/server.ts"
      }
    ]
  },
  "correctness": {
    "status": "passed",
    "registeredTiers": [
      1000,
      100000,
      1000000
    ],
    "oracle": "byte-exact canonical summary and exact structural counters",
    "counterIds": [
      "records",
      "input-bytes",
      "numeric-values",
      "string-values",
      "booleans",
      "query-aggregates",
      "output-bytes",
      "allocations",
      "boundary-crossings"
    ],
    "fullFixtureValidation": true
  },
  "performanceClaims": []
}
